[
 {
  "id": "NC-LAN-01",
  "evidenceId": "EVL-01",
  "claim": "An omgevingsplan setting rules for land within a 100-metre assessment zone around an existing nature area must motivate how the nature area is taken into account.",
  "source": {
   "docId": "S01",
   "article": "Artikel 18.41",
   "version": "CVDR709135, geldend van 02-06-2026 t/m heden",
   "quote": "Artikel 18.41 Afwegingszone natuurgebieden In de motivering bij een omgevingsplan waarin regels worden gesteld voor grond die ligt binnen de afwegingszone van 100 meter rond een bestaand natuurgebied, bedoeld in bijlage XII onder 4, wordt: a. een beschrijving gegeven van de wijze waarop rekening is gehouden met de wezenlijke kenmerken en waarden van het natuurgebied; en b. aannemelijk gemaakt dat geen activiteit wordt toegelaten die nadelige gevolgen heeft voor de bedoelde kenmerken en waarden. Afdeling 18.10 Landschap en erfgoed",
   "quoteLanguage": "nl",
   "uri": "https://lokaleregelgeving.overheid.nl/CVDR709135",
   "retrievedAt": "2026-10-14"
  },
  "instrument": "Omgevingsverordening Zeeland (CVDR709135, geldend van 02-06-2026 t/m heden)",
  "instrumentType": "omgevingsverordening-nl",
  "jurisdictie": "nl",
  "legalForce": "binding",
  "theme": "landscape:kwaliteit",
  "confidence": 0.9,
  "verified": true,
  "extractedBy": "curator#poc-nspd-fase2-t5",
  "extractedAt": "2026-10-14",
  "appliesTo": {
   "objectType": "landscape_intervention",
   "track": "landschap"
  },
  "notes": "Afwegingszone natuurgebieden (bijlage XII/4): motiveringseis; zone (100m rond natuurgebied) zonder geo-pin → zone-loos."
 },
 {
  "id": "NC-LAN-02",
  "evidenceId": "EVL-02",
  "claim": "An omgevingsplan affecting landscapes, landscape elements or cultural-historically valuable farms must provide insight into the landscape and cultural-historic values in its motivation.",
  "source": {
   "docId": "S01",
   "article": "Artikel 18.42",
   "version": "CVDR709135, geldend van 02-06-2026 t/m heden",
   "quote": "Artikel 18.42 Landschap en erfgoed 1 In de motivering bij een omgevingsplan dat regels stelt voor landschappen, landschapselementen, cultuurhistorisch waardevolle boerderijen of cultuurhistorische elementen als bedoeld in bijlage VII , wordt inzicht gegeven in de landschappelijke respectievelijk cultuurhistorische waarden van de gronden, boerderijen of elementen. 2 In een omgevingsplan worden geen activiteiten toegelaten die: a. het mogelijk maken dat de landschappelijke en cultuurhistorische waarden van de gronden of elementen significant worden aangetast; b. leiden tot een significante vermi",
   "quoteLanguage": "nl",
   "uri": "https://lokaleregelgeving.overheid.nl/CVDR709135",
   "retrievedAt": "2026-10-14"
  },
  "instrument": "Omgevingsverordening Zeeland (CVDR709135, geldend van 02-06-2026 t/m heden)",
  "instrumentType": "omgevingsverordening-nl",
  "jurisdictie": "nl",
  "legalForce": "binding",
  "theme": "landscape:kwaliteit",
  "confidence": 0.9,
  "verified": true,
  "extractedBy": "curator#poc-nspd-fase2-t5",
  "extractedAt": "2026-10-14",
  "appliesTo": {
   "objectType": "landscape_intervention",
   "track": "landschap"
  },
  "notes": "Landschap en erfgoed (bijlage VII): motiveringseis landschapskwaliteit; kernlandschapsnorm, zone-loos."
 }
]